{
  "$schema": "../schema/capture-template.schema.json",
  "category": "blighted-creature",
  "version": "1.0.0",
  "description": "Templates for Blight-corrupted creature encounters. Matched by keywords: blight, corrupted, infected.",
  "matchKeywords": ["blight", "corrupted", "infected", "creature"],
  "templates": [
    {
      "id": "blight-tissue-mutation",
      "type": "Specimen",
      "fragmentContent": "Tissue samples reveal extensive cellular mutation. The corruption spreads in fractal patterns, each branch terminating in crystalline nodules that pulse with faint light.",
      "source": "Biological analysis",
      "quality": 15,
      "tags": ["mutation", "crystalline", "cellular"]
    },
    {
      "id": "blight-awareness-retained",
      "type": "VisualRecord",
      "fragmentContent": "The creature's eyes retained a disturbing awareness even after death. Markings on the skull suggest this one was intelligent before the Blight claimed it.",
      "source": "Field observation",
      "matchKeywords": ["blight", "creature", "beast", "monster"],
      "quality": 15,
      "tags": ["intelligence", "transformation", "awareness"]
    },
    {
      "id": "blight-deliberate-exposure",
      "type": "RunicTrace",
      "fragmentContent": "Residual Aetheric contamination lingers in the remains. The corruption signature differs from natural Blight patterns, suggesting this specimen was deliberately exposed.",
      "source": "Aetheric analysis",
      "matchKeywords": ["blight", "aetheric", "corruption"],
      "quality": 15,
      "tags": ["deliberate", "aetheric", "contamination"]
    }
  ]
}
